{
  "$schema": "./PABC.MigrationService/dataset.schema.json",
  "applications": [
    {
      "id": "123e4567-e89b-12d3-a456-426614174000",
      "name": "zaakafhandelcomponent"
    },
    {
      "id": "789abcde-f012-3456-7890-abcdef123456",
      "name": "MyApplication2"
    }
  ],
  "applicationRoles": [
    {
      "id": "7839298d-9ac9-4b02-bcfc-18b5e6e00227",
      "applicationId": "123e4567-e89b-12d3-a456-426614174000",
      "name": "raadpleger"
    },
    {
      "id": "a6706ade-d3d5-4d9e-be84-032acf5bf9d1",
      "applicationId": "123e4567-e89b-12d3-a456-426614174000",
      "name": "behandelaar"
    },
    {
      "id": "03224fbe-84fc-46ad-8392-e7aa883f21aa",
      "applicationId": "123e4567-e89b-12d3-a456-426614174000",
      "name": "coordinator"
    },
    {
      "id": "fb0e0fb8-5a16-469c-82f4-d3ef6a767828",
      "applicationId": "123e4567-e89b-12d3-a456-426614174000",
      "name": "recordmanager"
    },
    {
      "id": "29fd3e52-193c-48e2-8471-2899130db153",
      "applicationId": "123e4567-e89b-12d3-a456-426614174000",
      "name": "beheerder"
    },
    {
      "id": "f5cf1465-c05a-4c95-98da-0ec6402161a0",
      "applicationId": "789abcde-f012-3456-7890-abcdef123456",
      "name": "MyAppRole2"
    },
    {
      "id": "d8b091f0-fc70-4825-9dac-5fcdec931f8e",
      "applicationId": "789abcde-f012-3456-7890-abcdef123456",
      "name": "NoEntityApplicationRole"
    }
  ],
  "functionalRoles": [
    { "id": "72d77855-318a-47e5-bdc8-aa1c3360d3eb", "name": "GemeenteRol1" },
    { "id": "09b78850-75cd-4b5f-b56c-3bee5261a0f9", "name": "GemeenteRol2" },
    {
      "id": "e5a7c8f9-3b12-4d67-9e8f-1a2b3c4d5e6f",
      "name": "AllEntityFunctionalRole"
    },
    {
      "id": "d5c09974-3eba-44de-a3c9-85d7bcbd0c66",
      "name": "NoEntityFunctionalRole"
    },
    {
      "id": "3704cc69-5e91-4243-835e-fcfb8e589327",
      "name": "behandelaar_alle_zaaktypes"
    },
    {
      "id": "21076d48-22fb-4280-9418-b707c1df820b",
      "name": "behandelaar_leefomgeving"
    },
    {
      "id": "753d4407-9716-4ac3-b1a0-deef2fe65ec9",
      "name": "behandelaar_bedrijfsvoering"
    },
    {
      "id": "c7764a52-b4ed-40f4-a308-f33a744ffabb",
      "name": "coordinator_alle_zaaktypes"
    },
    {
      "id": "a82d12ba-eb30-4e04-9114-0fc192ba669e",
      "name": "coordinator_bedrijfsvoering"
    },
    {
      "id": "74ad238f-6380-435d-b73e-9203f78b195e",
      "name": "coordinator_leefomgeving"
    }
  ],
  "entityTypes": [
    {
      "id": "49a3a65e-85d5-483f-94ef-cacde9b46392",
      "entityTypeId": "melding-klein-kansspel",
      "type": "ZAAKTYPE",
      "name": "Melding klein kansspel",
      "description": null,
      "uri": null
    },
    {
      "id": "df414340-ccc8-4538-b627-8f030d3fce5a",
      "entityTypeId": "4e082abc-128b-47fa-8d1d-4a215cd602d2",
      "type": "ZAAKTYPE",
      "name": "Aanvraag ontheffing bedrijfsvoertuigen behandelen",
      "description": null,
      "uri": null
    },
    {
      "id": "f644f9df-aa70-4046-a278-2069e23818f2",
      "entityTypeId": "1c59fbc4-e8cd-4ab0-92d1-5aa023a7c1c8",
      "type": "ZAAKTYPE",
      "name": "Aanvraag subsidieregeling Energieneutraal Ten Post behandelen",
      "description": null,
      "uri": null
    },
    {
      "id": "48634eaf-741c-4bc0-9ade-03886f08cb36",
      "entityTypeId": "a3469fab-dc42-4034-ac92-95d5682e78b9",
      "type": "ZAAKTYPE",
      "name": "Melding flyeren en samplen behandelen",
      "description": null,
      "uri": null
    }
  ],
  "domains": [
    {
      "id": "b9767da1-fb07-4e99-b790-04bf54482daf",
      "name": "Bedrijfsvoering",
      "description": "Domein bedrijfsvoering gaat over bedrijfsvoering",
      "entityTypeIds": [
        "49a3a65e-85d5-483f-94ef-cacde9b46392",
        "df414340-ccc8-4538-b627-8f030d3fce5a",
        "f644f9df-aa70-4046-a278-2069e23818f2"
      ]
    },
    {
      "id": "afb5dc7f-b75b-4b85-99b6-c9f141d3cab7",
      "name": "Leefomgeving",
      "description": "Domein leefomgeving gaat over leefomgeving",
      "entityTypeIds": [
        "f644f9df-aa70-4046-a278-2069e23818f2",
        "48634eaf-741c-4bc0-9ade-03886f08cb36"
      ]
    },
    {
      "id": "dc503379-0860-4971-bfe4-6335838d8181",
      "name": "Ruimte",
      "description": "Domein ruimte gaat over ruimte",
      "entityTypeIds": [
        "f644f9df-aa70-4046-a278-2069e23818f2",
        "48634eaf-741c-4bc0-9ade-03886f08cb36"
      ]
    }
  ],
  "mappings": [
    {
      "id": "a1b2c3d4-e5f6-4a7b-8c9d-0e1f2a3b4c5d",
      "functionalRoleId": "e5a7c8f9-3b12-4d67-9e8f-1a2b3c4d5e6f",
      "applicationRoleId": "7839298d-9ac9-4b02-bcfc-18b5e6e00227",
      "isAllEntityTypes": true
    },
    {
      "id": "2e458076-5a94-4d71-b0c6-ad059a719c27",
      "functionalRoleId": "72d77855-318a-47e5-bdc8-aa1c3360d3eb",
      "domainId": "b9767da1-fb07-4e99-b790-04bf54482daf",
      "applicationRoleId": "7839298d-9ac9-4b02-bcfc-18b5e6e00227"
    },
    {
      "id": "cd1a2f57-2a2e-4d28-8ec5-231d6a4e3700",
      "functionalRoleId": "09b78850-75cd-4b5f-b56c-3bee5261a0f9",
      "domainId": "afb5dc7f-b75b-4b85-99b6-c9f141d3cab7",
      "applicationRoleId": "a6706ade-d3d5-4d9e-be84-032acf5bf9d1"
    },
    {
      "id": "eccaabe9-8b26-4bc8-879c-55762e955398",
      "functionalRoleId": "09b78850-75cd-4b5f-b56c-3bee5261a0f9",
      "domainId": "b9767da1-fb07-4e99-b790-04bf54482daf",
      "applicationRoleId": "03224fbe-84fc-46ad-8392-e7aa883f21aa"
    },
    {
      "id": "8998615c-cfa3-4829-8047-2706dc8cff91",
      "functionalRoleId": "72d77855-318a-47e5-bdc8-aa1c3360d3eb",
      "domainId": "afb5dc7f-b75b-4b85-99b6-c9f141d3cab7",
      "applicationRoleId": "fb0e0fb8-5a16-469c-82f4-d3ef6a767828"
    },
    {
      "id": "00045a18-9a15-48e4-b4af-27ccfda10638",
      "functionalRoleId": "72d77855-318a-47e5-bdc8-aa1c3360d3eb",
      "domainId": "dc503379-0860-4971-bfe4-6335838d8181",
      "applicationRoleId": "29fd3e52-193c-48e2-8471-2899130db153"
    },
    {
      "id": "4e40db32-a99c-4c3a-9390-409ce8a5b9ff",
      "functionalRoleId": "72d77855-318a-47e5-bdc8-aa1c3360d3eb",
      "domainId": "dc503379-0860-4971-bfe4-6335838d8181",
      "applicationRoleId": "f5cf1465-c05a-4c95-98da-0ec6402161a0"
    },
    {
      "id": "eecc3f96-0a40-4e1f-832a-dbaffe5aa61d",
      "functionalRoleId": "d5c09974-3eba-44de-a3c9-85d7bcbd0c66",
      "applicationRoleId": "d8b091f0-fc70-4825-9dac-5fcdec931f8e"
    },
    {
      "id": "2ef0cd45-b452-459e-a18c-04115be983af",
      "functionalRoleId": "3704cc69-5e91-4243-835e-fcfb8e589327",
      "applicationRoleId": "a6706ade-d3d5-4d9e-be84-032acf5bf9d1",
      "isAllEntityTypes": true
    },
    {
      "id": "7f439dcc-f545-48c2-a75c-994b0816ffc7",
      "functionalRoleId": "21076d48-22fb-4280-9418-b707c1df820b",
      "applicationRoleId": "a6706ade-d3d5-4d9e-be84-032acf5bf9d1",
      "domainId": "afb5dc7f-b75b-4b85-99b6-c9f141d3cab7"
    },
    {
      "id": "c66fc0e6-97fd-4e64-a3fc-ab0c7092ecc9",
      "functionalRoleId": "21076d48-22fb-4280-9418-b707c1df820b",
      "applicationRoleId": "a6706ade-d3d5-4d9e-be84-032acf5bf9d1",
      "domainId": "b9767da1-fb07-4e99-b790-04bf54482daf"
    }
  ]
}
